{
  "$schema": "https://json-schema.org/draft/2020-12/schema",
  "$id": "https://github.com/Extra-Chill/homeboy-extensions/dependency-adapters/schema.json",
  "title": "Homeboy Extensions Dependency Adapter Manifest",
  "type": "object",
  "additionalProperties": false,
  "required": ["schema", "id", "version", "ecosystem", "project_signals", "capabilities"],
  "properties": {
    "schema": {
      "const": "homeboy-extension/dependency-adapter-manifest/v1"
    },
    "id": {
      "type": "string",
      "pattern": "^[a-z0-9][a-z0-9._-]*$"
    },
    "version": {
      "type": "integer",
      "minimum": 1
    },
    "ecosystem": {
      "type": "string",
      "pattern": "^[a-z0-9][a-z0-9._-]*$"
    },
    "description": {
      "type": "string"
    },
    "project_signals": {
      "type": "object",
      "additionalProperties": false,
      "required": ["root_files"],
      "properties": {
        "root_files": {
          "type": "array",
          "minItems": 1,
          "items": { "type": "string" }
        },
        "root_match": {
          "type": "string",
          "enum": ["any", "all"]
        },
        "optional_files": {
          "type": "array",
          "items": { "type": "string" }
        }
      }
    },
    "capabilities": {
      "type": "object",
      "additionalProperties": false,
      "properties": {
        "discover_project_root": { "type": "boolean" },
        "select_package_manager": { "type": "boolean" },
        "install_dependencies": { "type": "boolean" },
        "run_named_scripts": { "type": "boolean" },
        "execute_bins": { "type": "boolean" },
        "prepare_runtime_helpers": { "type": "boolean" }
      }
    },
    "lockfile_priority": {
      "type": "array",
      "items": { "type": "string" }
    },
    "package_managers": {
      "type": "array",
      "items": { "$ref": "#/$defs/package_manager" }
    },
    "helpers": {
      "type": "array",
      "items": { "$ref": "#/$defs/helper" }
    }
  },
  "$defs": {
    "package_manager": {
      "type": "object",
      "additionalProperties": false,
      "required": ["id", "selection", "install", "outputs"],
      "properties": {
        "id": {
          "type": "string",
          "pattern": "^[a-z0-9][a-z0-9._-]*$"
        },
        "selection": {
          "type": "object",
          "additionalProperties": false,
          "required": ["priority"],
          "properties": {
            "priority": { "type": "integer", "minimum": 1 },
            "files": {
              "type": "array",
              "items": { "type": "string" }
            },
            "search": {
              "type": "string",
              "enum": ["project-root", "upward"]
            },
            "default": { "type": "boolean" }
          }
        },
        "install": {
          "type": "object",
          "additionalProperties": false,
          "required": ["intent"],
          "properties": {
            "intent": {
              "type": "string",
              "enum": ["frozen-lockfile", "locked-or-refresh", "install"]
            },
            "command": { "type": "string" },
            "fallback_command": { "type": "string" }
          }
        },
        "commands": {
          "type": "object",
          "additionalProperties": false,
          "properties": {
            "status": { "$ref": "#/$defs/command" },
            "install": { "$ref": "#/$defs/command" },
            "update": { "$ref": "#/$defs/command" }
          }
        },
        "scripts": {
          "type": "object",
          "additionalProperties": false,
          "properties": {
            "manifest": { "type": "string" },
            "run_command": { "type": "string" },
            "exec_command": { "type": "string" }
          }
        },
        "package_identity": { "$ref": "#/$defs/package_identity" },
        "outputs": {
          "type": "array",
          "minItems": 1,
          "items": { "$ref": "#/$defs/output" }
        }
      }
    },
    "command": {
      "type": "object",
      "additionalProperties": false,
      "required": ["command"],
      "properties": {
        "command": { "type": "string" },
        "success_exit_codes": {
          "type": "array",
          "items": { "type": "integer", "minimum": 0 }
        },
        "produces_lockfile": { "type": "boolean" },
        "requires_lockfile": { "type": "boolean" }
      }
    },
    "package_identity": {
      "type": "object",
      "additionalProperties": false,
      "required": ["manifest", "name", "version"],
      "properties": {
        "manifest": { "type": "string" },
        "name": { "type": "string" },
        "version": { "type": "string" },
        "dependencies": {
          "type": "array",
          "items": { "type": "string" }
        },
        "lockfile": {
          "type": "object",
          "description": "JSON lockfile recording resolved versions, read by status without installing. `packages` names keys whose values are arrays of package entries; `name` and `version` are field names within an entry; `reference` is an ordered list of dotted fallback paths to the resolved commit.",
          "additionalProperties": false,
          "required": ["path", "packages"],
          "properties": {
            "path": { "type": "string" },
            "packages": {
              "type": "array",
              "items": { "type": "string" },
              "minItems": 1
            },
            "name": { "type": "string", "default": "name" },
            "version": { "type": "string", "default": "version" },
            "reference": {
              "type": "array",
              "items": { "type": "string" }
            }
          }
        }
      }
    },
    "helper": {
      "type": "object",
      "additionalProperties": false,
      "required": ["id", "description", "requires", "outputs"],
      "properties": {
        "id": {
          "type": "string",
          "pattern": "^[a-z0-9][a-z0-9._-]*$"
        },
        "description": { "type": "string" },
        "requires": {
          "type": "array",
          "items": { "type": "string" }
        },
        "outputs": {
          "type": "array",
          "items": { "$ref": "#/$defs/output" }
        }
      }
    },
    "output": {
      "type": "object",
      "additionalProperties": false,
      "required": ["kind", "path"],
      "properties": {
        "kind": {
          "type": "string",
          "enum": ["file", "directory", "glob", "runtime-capability"]
        },
        "path": { "type": "string" },
        "required": { "type": "boolean" }
      }
    }
  }
}
