{
  "schema": "homeboy-extension/dependency-adapter-manifest/v1",
  "id": "nodejs-package-managers",
  "version": 2,
  "ecosystem": "nodejs",
  "description": "Declarative Node.js package manager selection and dependency materialization outputs.",
  "project_signals": {
    "root_files": ["package.json"],
    "optional_files": ["pnpm-workspace.yaml", "pnpm-lock.yaml", "yarn.lock", "package-lock.json"]
  },
  "lockfile_priority": ["pnpm-lock.yaml", "yarn.lock", "package-lock.json"],
  "capabilities": {
    "discover_project_root": true,
    "select_package_manager": true,
    "install_dependencies": true,
    "run_named_scripts": true,
    "execute_bins": true,
    "prepare_runtime_helpers": false
  },
  "package_managers": [
    {
      "id": "pnpm",
      "selection": {
        "priority": 1,
        "search": "upward",
        "files": ["pnpm-workspace.yaml", "pnpm-lock.yaml"]
      },
      "install": {
        "intent": "frozen-lockfile",
        "command": "pnpm install --frozen-lockfile"
      },
      "commands": {
        "status": {
          "command": "pnpm install --frozen-lockfile --offline",
          "success_exit_codes": [0],
          "requires_lockfile": true
        },
        "install": {
          "command": "pnpm install --frozen-lockfile",
          "success_exit_codes": [0],
          "requires_lockfile": true
        },
        "update": {
          "command": "pnpm install --lockfile-only",
          "success_exit_codes": [0],
          "produces_lockfile": true
        }
      },
      "scripts": {
        "manifest": "package.json",
        "run_command": "pnpm run",
        "exec_command": "pnpm exec"
      },
      "package_identity": {
        "manifest": "package.json",
        "name": "name",
        "version": "version",
        "dependencies": ["dependencies", "devDependencies", "peerDependencies", "optionalDependencies"]
      },
      "outputs": [{ "kind": "directory", "path": "node_modules", "required": true }]
    },
    {
      "id": "yarn",
      "selection": {
        "priority": 2,
        "search": "project-root",
        "files": ["yarn.lock"]
      },
      "install": {
        "intent": "frozen-lockfile",
        "command": "yarn install --frozen-lockfile"
      },
      "commands": {
        "status": {
          "command": "yarn install --frozen-lockfile --offline",
          "success_exit_codes": [0],
          "requires_lockfile": true
        },
        "install": {
          "command": "yarn install --frozen-lockfile",
          "success_exit_codes": [0],
          "requires_lockfile": true
        },
        "update": {
          "command": "yarn install --mode=update-lockfile",
          "success_exit_codes": [0],
          "produces_lockfile": true
        }
      },
      "scripts": {
        "manifest": "package.json",
        "run_command": "yarn",
        "exec_command": "yarn"
      },
      "package_identity": {
        "manifest": "package.json",
        "name": "name",
        "version": "version",
        "dependencies": ["dependencies", "devDependencies", "peerDependencies", "optionalDependencies"]
      },
      "outputs": [{ "kind": "directory", "path": "node_modules", "required": true }]
    },
    {
      "id": "npm",
      "selection": {
        "priority": 3,
        "search": "project-root",
        "default": true,
        "files": ["package-lock.json"]
      },
      "install": {
        "intent": "locked-or-refresh",
        "command": "npm ci",
        "fallback_command": "npm install"
      },
      "commands": {
        "status": {
          "command": "npm ci --dry-run",
          "success_exit_codes": [0],
          "requires_lockfile": true
        },
        "install": {
          "command": "npm ci",
          "success_exit_codes": [0],
          "requires_lockfile": true
        },
        "update": {
          "command": "npm install --package-lock-only",
          "success_exit_codes": [0],
          "produces_lockfile": true
        }
      },
      "scripts": {
        "manifest": "package.json",
        "run_command": "npm run",
        "exec_command": "npx"
      },
      "package_identity": {
        "manifest": "package.json",
        "name": "name",
        "version": "version",
        "dependencies": ["dependencies", "devDependencies", "peerDependencies", "optionalDependencies"]
      },
      "outputs": [{ "kind": "directory", "path": "node_modules", "required": true }]
    }
  ]
}
